smartctl 7.3 2022-02-28 r5338 [x86_64-linux-6.5.13-1-pve] (local build)
Copyright (C) 2002-22, Bruce Allen, Christian Franke, www.smartmontools.org

=== START OF INFORMATION SECTION ===
Model Family:     Intel S3500 Series SSDs
Device Model:     INTEL SSDSC2BB480H4
Serial Number:    BTWA000A1234567A
LU WWN Device Id: 5 5cd2e4 04b9a1234
Firmware Version: D2010370
User Capacity:    480,103,981,056 bytes [480 GB]
Sector Size:      512 bytes logical/physical
Rotation Rate:    Solid State Device
Form Factor:      2.5 inches
Device is:        In smartctl database 7.3/5319
ATA Version is:   ACS-2 (minor revision not indicated)
SATA Version is:  SATA 3.0, 6.0 Gb/s (current: 6.0 Gb/s)
Local Time is:    Mon May 10 03:00:00 2026 UTC
SMART support is: Available - device has SMART capability.
SMART support is: Enabled

=== START OF READ SMART DATA SECTION ===
SMART overall-health self-assessment test result: PASSED

SMART Attributes Data Structure revision number: 1
Vendor Specific SMART Attributes with Thresholds:
ID# ATTRIBUTE_NAME          FLAG     VALUE WORST THRESH TYPE      UPDATED  WHEN_FAILED RAW_VALUE
  5 Reallocated_Sector_Ct   0x0032   100   100   000    Old_age   Always       -       0
  9 Power_On_Hours          0x0032   100   100   000    Old_age   Always       -       18234
 12 Power_Cycle_Count       0x0032   100   100   000    Old_age   Always       -       42
171 Unknown_Attribute       0x0032   100   100   000    Old_age   Always       -       0
172 Unknown_Attribute       0x0032   100   100   000    Old_age   Always       -       0
174 Unsafe_Shutdown_Count   0x0032   100   100   000    Old_age   Always       -       1
183 SATA_Downshift_Count    0x0032   100   100   000    Old_age   Always       -       0
184 End-to-End_Error        0x0033   100   100   090    Pre-fail  Always       -       0
187 Reported_Uncorrect      0x0032   100   100   000    Old_age   Always       -       0
190 Airflow_Temperature_Cel 0x0022   072   045   000    Old_age   Always       -       28 (Min/Max 24/45)
192 Unsafe_Shutdown_Count   0x0032   100   100   000    Old_age   Always       -       1
194 Temperature_Celsius     0x0022   100   100   000    Old_age   Always       -       28
197 Current_Pending_Sector  0x0032   100   100   000    Old_age   Always       -       0
199 UDMA_CRC_Error_Count    0x003e   100   100   000    Old_age   Always       -       0
225 Host_Writes_32MiB       0x0032   100   100   000    Old_age   Always       -       9876543
226 Workld_Media_Wear_Indic 0x0032   100   100   000    Old_age   Always       -       12345
227 Workld_Host_Reads_Perc  0x0032   100   100   000    Old_age   Always       -       50
228 Workload_Minutes        0x0032   100   100   000    Old_age   Always       -       1093412
232 Available_Reservd_Space 0x0033   100   100   010    Pre-fail  Always       -       0
233 Media_Wearout_Indicator 0x0032   085   085   000    Old_age   Always       -       0
241 Host_Writes_32MiB       0x0032   100   100   000    Old_age   Always       -       9876543
242 Host_Reads_32MiB        0x0032   100   100   000    Old_age   Always       -       9876544

SMART Error Log Version: 1
No Errors Logged
